[
  {
    "id": "microsoft-constellation-crane-restart",
    "name": "Microsoft – Constellation Crane restart PPA",
    "parties": {
      "offtaker": "Microsoft",
      "offtaker_type": "hyperscaler",
      "developer": "Constellation Energy",
      "technology_vendor": null,
      "utility": null,
      "epc": null
    },
    "technology": "restart",
    "mw_firm": 835,
    "mw_optioned": null,
    "structure_type": "restart_ppa",
    "bindingness": {
      "tier": "B4",
      "evidence": "The parties signed a 20-year PPA, Constellation began physical restoration work, PJM approved the interconnection request, and NRC restart reviews are active."
    },
    "dates": {
      "announced": "2024-09-20",
      "target_cod": "2027",
      "status_changes": [
        { "date": "2025-08-07", "change": "Target restart advanced from 2028 to 2027." },
        { "date": "2026-06-03", "change": "NRC issued a draft environmental assessment and finding of no significant impact." }
      ]
    },
    "location": {
      "site": "Christopher M. Crane Clean Energy Center",
      "state": "Pennsylvania",
      "country": "United States",
      "grid_region": "PJM"
    },
    "sources": [
      {
        "url": "https://investors.constellationenergy.com/news-releases/news-release-details/constellation-launch-crane-clean-energy-center-restoring-jobs",
        "publisher": "Constellation Energy",
        "title": "Constellation to Launch Crane Clean Energy Center, Restoring Jobs and Carbon-free Power to the Grid",
        "date": "2024-09-20",
        "supports": "Signed 20-year PPA, Microsoft counterparty, restart structure, approximately 835 MW, and original 2028 target."
      },
      {
        "url": "https://www.nrc.gov/info-finder/reactors/ccec",
        "publisher": "U.S. Nuclear Regulatory Commission",
        "title": "Christopher M. Crane Clean Energy Center",
        "date": "2026-06-05",
        "supports": "Current restart licensing review, inspections, and June 2026 draft environmental assessment milestone."
      },
      {
        "url": "https://investors.constellationenergy.com/news-releases/news-release-details/constellation-reports-second-quarter-2025-results",
        "publisher": "Constellation Energy",
        "title": "Constellation Reports Second Quarter 2025 Results",
        "date": "2025-08-07",
        "supports": "Acceleration of the target restart year from 2028 to 2027."
      }
    ],
    "analyst_note": "A signed PPA underwrites the restart. The plant remains in NRC review and is not yet operating.",
    "needs_verification": false,
    "last_verified": "2026-08-03"
  },
  {
    "id": "amazon-talen-susquehanna-ppa",
    "name": "Amazon – Talen Susquehanna PPA",
    "parties": {
      "offtaker": "Amazon Web Services",
      "offtaker_type": "hyperscaler",
      "developer": "Talen Energy",
      "technology_vendor": null,
      "utility": "PPL Electric Utilities",
      "epc": null
    },
    "technology": "existing_plant_ppa",
    "mw_firm": 1920,
    "mw_optioned": null,
    "structure_type": "ppa_front_of_meter",
    "bindingness": {
      "tier": "B3",
      "evidence": "Talen and Amazon executed an expanded long-term PPA with minimum commitments and a ramp to the full 1,920 MW contract quantity."
    },
    "dates": {
      "announced": "2024-03-04",
      "target_cod": "Full contract quantity by 2032",
      "status_changes": [
        { "date": "2024-11-01", "change": "FERC rejected the requested expansion of the original co-located interconnection arrangement." },
        { "date": "2025-06-11", "change": "Parties expanded the PPA to 1,920 MW and shifted toward a front-of-meter structure." }
      ]
    },
    "location": {
      "site": "Susquehanna Steam Electric Station",
      "state": "Pennsylvania",
      "country": "United States",
      "grid_region": "PJM"
    },
    "sources": [
      {
        "url": "https://ir.talenenergy.com/news-releases/news-release-details/talen-energy-expands-nuclear-energy-relationship-amazon",
        "publisher": "Talen Energy",
        "title": "Talen Energy Expands Nuclear Energy Relationship with Amazon",
        "date": "2025-06-11",
        "supports": "Expanded PPA, 1,920 MW full contract quantity, delivery through 2042, ramp by 2032, and front-of-meter transition."
      },
      {
        "url": "https://ir.talenenergy.com/news-releases/news-release-details/talen-energy-announces-sale-zero-carbon-data-center-campus",
        "publisher": "Talen Energy",
        "title": "Talen Energy Announces Sale of Zero-Carbon Data Center Campus",
        "date": "2024-03-04",
        "supports": "Original campus sale, Susquehanna supply relationship, and announcement date."
      },
      {
        "url": "https://ir.talenenergy.com/node/9206/html",
        "publisher": "Talen Energy",
        "title": "Talen 2025 Form 10-K",
        "date": "2026-02-26",
        "supports": "FERC history, minimum commitments, ramp schedule, and transition from the original PPA to the amended front-of-meter PPA."
      }
    ],
    "analyst_note": "The current record reflects the June 2025 amended PPA, which is replacing the original behind-the-meter structure.",
    "needs_verification": false,
    "last_verified": "2026-08-03"
  },
  {
    "id": "amazon-energy-northwest-cascade",
    "name": "Amazon – Energy Northwest Cascade SMRs",
    "parties": {
      "offtaker": "Amazon",
      "offtaker_type": "hyperscaler",
      "developer": "Energy Northwest",
      "technology_vendor": "X-energy",
      "utility": "Energy Northwest",
      "epc": null
    },
    "technology": "smr",
    "mw_firm": 320,
    "mw_optioned": 640,
    "structure_type": "development_funding",
    "bindingness": {
      "tier": "B2",
      "evidence": "Amazon committed nearly $334 million to feasibility and licensing work and received purchase rights, but no operating PPA has been disclosed."
    },
    "dates": {
      "announced": "2024-10-16",
      "target_cod": "2030s",
      "status_changes": []
    },
    "location": {
      "site": "Cascade Advanced Energy Facility near Columbia Generating Station",
      "state": "Washington",
      "country": "United States",
      "grid_region": "WECC"
    },
    "sources": [
      {
        "url": "https://www.aboutamazon.com/news/sustainability/amazon-nuclear-small-modular-reactor-net-carbon-zero",
        "publisher": "Amazon",
        "title": "Amazon signs agreements for innovative nuclear energy projects to address growing energy demands",
        "date": "2024-10-16",
        "supports": "Amazon agreement, X-energy investment, Energy Northwest project, and initial 320 MW description."
      },
      {
        "url": "https://www.energy-northwest.com/whoweare/finance/Documents/EN%202025AB%20Amended%20Official%20Statement.pdf",
        "publisher": "Energy Northwest",
        "title": "2025A/B Electric Revenue Bonds Amended Official Statement",
        "date": "2025-05-19",
        "supports": "Nearly $334 million funding, two-year feasibility phase, Amazon purchase right for 320 MW, and Energy Northwest option for another 640 MW."
      }
    ],
    "analyst_note": "The initial four-module project is shown as firm project capacity. The separate eight-module expansion remains optioned.",
    "needs_verification": false,
    "last_verified": "2026-08-03"
  },
  {
    "id": "amazon-dominion-north-anna-smr",
    "name": "Amazon – Dominion North Anna SMR exploration",
    "parties": {
      "offtaker": "Amazon",
      "offtaker_type": "hyperscaler",
      "developer": "Dominion Energy Virginia",
      "technology_vendor": null,
      "utility": "Dominion Energy Virginia",
      "epc": null
    },
    "technology": "smr",
    "mw_firm": null,
    "mw_optioned": 300,
    "structure_type": "mou_collaboration",
    "bindingness": {
      "tier": "B1",
      "evidence": "The parties signed an MOU to explore development and financing structures; Dominion states that its SMR request is not a commitment to build."
    },
    "dates": {
      "announced": "2024-10-16",
      "target_cod": "2030s",
      "status_changes": []
    },
    "location": {
      "site": "North Anna Power Station",
      "state": "Virginia",
      "country": "United States",
      "grid_region": "PJM"
    },
    "sources": [
      {
        "url": "https://news.dominionenergy.com/press-releases/press-releases/2024/Dominion-Energy-and-Amazon-to-explore-advancement-of-Small-Modular-Reactor-SMR-nuclear-development-in-Virginia-10-16-2024/default.aspx",
        "publisher": "Dominion Energy",
        "title": "Dominion Energy and Amazon to explore advancement of Small Modular Reactor nuclear development in Virginia",
        "date": "2024-10-16",
        "supports": "MOU status, exploratory scope, North Anna site, and lack of a build commitment."
      },
      {
        "url": "https://www.aboutamazon.com/news/sustainability/amazon-nuclear-small-modular-reactor-net-carbon-zero",
        "publisher": "Amazon",
        "title": "Amazon signs agreements for innovative nuclear energy projects to address growing energy demands",
        "date": "2024-10-16",
        "supports": "Amazon describes the potential Virginia project as at least 300 MW."
      }
    ],
    "analyst_note": "The 300 MW figure is a potential project scale, not contracted capacity. No reactor vendor is public.",
    "needs_verification": true,
    "last_verified": "2026-08-03"
  },
  {
    "id": "google-kairos-reactor-fleet",
    "name": "Google – Kairos advanced reactor fleet",
    "parties": {
      "offtaker": "Google",
      "offtaker_type": "hyperscaler",
      "developer": "Kairos Power",
      "technology_vendor": "Kairos Power",
      "utility": null,
      "epc": null
    },
    "technology": "smr",
    "mw_firm": null,
    "mw_optioned": 450,
    "structure_type": "master_agreement",
    "bindingness": {
      "tier": "B2",